special_id,name,provenance,courseList
spc00204,"Espace mondial, a French vision of Global studies",Sciences Po,"csr01768, csr01769, csr01770, csr01771, csr01772, csr01773, csr01774"
spc00205,Innovative Finance: Hacking finance to change the world ,University of Cape Town,"csr01789, csr01790, csr01791, csr01792, csr01793, csr01794"
spc00206,Content Strategy for Professionals: Expanding Your Contents Reach,Northwestern University,"csr01795, csr01796, csr01797, csr01798, csr01799, csr01800"
spc00207,Survey analysis to Gain Marketing Insights,Emory University,"csr01839, csr01840, csr01841, csr01842"
spc00208,The Importance of Listening,Northwestern University,"csr01862, csr01863, csr01864, csr01865, csr01866"
spc00209,Pricing Strategy,IE Business School,"csr01867, csr01868, csr01869, csr01870, csr01871"
spc00210,The Business of Social,Northwestern University,"csr01872, csr01873, csr01874, csr01875, csr01876"
spc00211,Channel Management and Retailing ,IE Business School,"csr01877, csr01878, csr01879, csr01880"
spc00212,Introduction to Social Media Analytics,Emory University,"csr01881, csr01882, csr01883, csr01884, csr01885"
spc00213,Essentials of Corporate Finance,The University of Melbourne,"csr01886, csr01887, csr01888, csr01889, csr01890, csr01891, csr01892"
spc00214,Investigacin de mercados y comportamiento del consumidor,IE Business School,"csr01893, csr01894, csr01895, csr01896, csr01897"
spc00215,Business Analytics,University of Pennsylvania,"csr01898, csr01899, csr01900, csr01901"
spc00216,Fundamentals of Global Energy Business,University of Colorado System,"csr01902, csr01903, csr01904, csr01905, csr01906"
spc00217,Business Growth Strategy,University of Virginia,"csr01907, csr01908, csr01909, csr01910, csr01911"
spc00218,Questionnaire Design for Social Surveys,University of Michigan,"csr01922, csr01923, csr01924, csr01925, csr01926"
spc00219,Capstone Design Project in Power Electronics,University of Colorado Boulder,"csr01966, csr01967, csr01968, csr01969, csr01970"
spc00220,Competitive Strategy and Organization Design Project,Ludwig-Maximilians-Universitt Mnchen (LMU),"csr01971, csr01972, csr01973, csr01974, csr01975"
spc00221,Design and Build a Data Warehouse for Business Intelligence Implementation,University of Colorado System,"csr01976, csr01977, csr01978, csr01979"
spc00222,Game Design Document: Define the Art & Concepts,California Institute of the Arts,"csr01980, csr01981, csr01982, csr01983, csr01984"
spc00223,Introduction to Typography,California Institute of the Arts,"csr01985, csr01986, csr01987, csr01988, csr01989"